{
    "palette": [
        { "slug": "base", "name": "Nuit", "color": "#160509", "role": "background" },
        { "slug": "contrast", "name": "Craie", "color": "#F7EBDD", "role": "text" },
        { "slug": "rouge", "name": "Rouge Moulin", "color": "#C8102E", "role": "primary" },
        { "slug": "gold", "name": "Or de Scène", "color": "#D9A441", "role": "accent" },
        { "slug": "velvet", "name": "Velours", "color": "#2A0E16", "role": "surface" },
        { "slug": "poudre", "name": "Poudre", "color": "#EDCFC3", "role": "muted" }
    ],
    "spacing": {
        "scale_unit": "px",
        "steps": [
            { "slug": "20", "size": "10px" },
            { "slug": "30", "size": "20px" },
            { "slug": "40", "size": "30px" },
            { "slug": "50", "size": "clamp(30px, 5vw, 50px)" },
            { "slug": "60", "size": "clamp(30px, 7vw, 70px)" },
            { "slug": "70", "size": "clamp(50px, 7vw, 90px)" },
            { "slug": "80", "size": "clamp(70px, 10vw, 140px)" }
        ]
    },
    "typography": {
        "families": [
            { "slug": "manrope", "name": "Manrope", "fontFamily": "Manrope, sans-serif" },
            { "slug": "fira-code", "name": "Fira Code", "fontFamily": "\"Fira Code\", monospace" },
            { "slug": "affiche", "name": "Affiche", "fontFamily": "Futura, 'Futura PT', 'Century Gothic', 'Avenir Next', 'Trebuchet MS', sans-serif" },
            { "slug": "boulevard", "name": "Boulevard", "fontFamily": "Didot, 'Didot LT STD', 'Bodoni MT', 'Bodoni 72', 'Playfair Display', Georgia, serif" }
        ],
        "sizes": [
            { "slug": "small", "size": "0.875rem", "fluid": false },
            { "slug": "medium", "size": "1rem", "fluid": { "min": "1rem", "max": "1.125rem" } },
            { "slug": "large", "size": "1.38rem", "fluid": { "min": "1.125rem", "max": "1.375rem" } },
            { "slug": "x-large", "size": "1.75rem", "fluid": { "min": "1.75rem", "max": "2rem" } },
            { "slug": "xx-large", "size": "2.15rem", "fluid": { "min": "2.15rem", "max": "3rem" } },
            { "slug": "display", "size": "4rem", "fluid": { "min": "2.75rem", "max": "6rem" } }
        ]
    },
    "layout": {
        "contentSize": "645px",
        "wideSize": "1340px"
    }
}
